{
  "$schema": "https://json-schema.org/draft/2020-12/schema",
  "$id": "urn:tokentrimmer:receipt:wfr:structural-schema:v1-v4",
  "title": "TokenTrimmer workflow-run receipt",
  "description": "Structural contract for offline-verifiable workflow-run receipts. v1/v2 are legacy positive-only formats; v3/v4 sign the strict request-delta formula, complete coverage, and signed result. Use tt verify-receipt with a trusted out-of-band key to verify the signature.",
  "$comment": "This schema validates receipt structure only. It does not validate an Ed25519 signature, issuer identity, savings methodology, provider usage, or invoice reconciliation. Unknown additive fields are allowed for forward-compatible response envelopes.",
  "type": "object",
  "required": [
    "run_id",
    "org_id",
    "workflow_id",
    "status",
    "cost_micros",
    "baseline_micros",
    "saved_micros",
    "signature_hex",
    "verifying_key_hex",
    "canonical_version"
  ],
  "properties": {
    "run_id": {
      "$ref": "#/$defs/uuid",
      "description": "Workflow run UUID; also the receipt primary key."
    },
    "org_id": {
      "$ref": "#/$defs/uuid",
      "description": "Organization UUID, signed as canonical payload field 2."
    },
    "workflow_id": {
      "$ref": "#/$defs/uuid",
      "description": "Workflow UUID, signed as canonical payload field 3."
    },
    "status": {
      "type": "string",
      "minLength": 1,
      "pattern": "^[^|]+$",
      "description": "Nonempty terminal run status. A pipe is forbidden because it is the canonical payload separator."
    },
    "cost_micros": {
      "$ref": "#/$defs/micro_usd",
      "description": "Recorded catalog-priced run cost in integer micro-USD; signed directly."
    },
    "baseline_micros": {
      "$ref": "#/$defs/micro_usd",
      "description": "Recorded catalog-priced baseline estimate in integer micro-USD; signed directly."
    },
    "saved_micros": {
      "$ref": "#/$defs/micro_usd",
      "description": "Positive-only request delta in integer micro-USD; for v3/v4 it must equal max(signed_request_delta_micros, 0)."
    },
    "signed_request_delta_micros": {
      "type": ["integer", "null"],
      "description": "Signed request delta in micro-USD. Required and signed by v3/v4; regressions remain negative."
    },
    "request_delta_formula_version": {
      "type": ["string", "null"],
      "description": "Exact request-delta formula identifier. v3/v4 require tt.request-delta-estimate.v1."
    },
    "request_delta_eligible_requests": {
      "type": ["integer", "null"],
      "minimum": 0,
      "description": "Non-truncated requests in the signed run cohort."
    },
    "request_delta_measured_requests": {
      "type": ["integer", "null"],
      "minimum": 0,
      "description": "Strictly measured requests. v3/v4 require a nonempty, completely measured cohort."
    },
    "cost_usd": {
      "type": ["number", "null"],
      "description": "Convenience display field only; not part of the signature."
    },
    "baseline_usd": {
      "type": ["number", "null"],
      "description": "Convenience display field only; not part of the signature."
    },
    "saved_usd": {
      "type": ["number", "null"],
      "description": "Convenience display field only; not part of the signature."
    },
    "signed_request_delta_usd": {
      "type": ["number", "null"],
      "description": "Convenience signed request delta only; not part of the signature."
    },
    "signature_hex": {
      "type": "string",
      "pattern": "^[0-9A-Fa-f]{128}$",
      "description": "Hex-encoded 64-byte Ed25519 signature over the canonical payload."
    },
    "verifying_key_hex": {
      "type": "string",
      "pattern": "^[0-9A-Fa-f]{64}$",
      "description": "Hex-encoded 32-byte Ed25519 public key. Trust must be established out of band."
    },
    "canonical_version": {
      "type": "string",
      "enum": ["v1", "v2", "v3", "v4"],
      "description": "v1/v2 are legacy; v3/v4 sign request-delta formula, coverage, and signed money. v2/v4 append quality_verdict."
    },
    "quality_verdict": {
      "type": ["string", "null"],
      "pattern": "^[^|]*$",
      "description": "Required, non-empty, and signed for v2/v4. Null or omitted for v1/v3."
    },
    "signed_at": {
      "type": ["string", "null"],
      "format": "date-time",
      "description": "Receipt mint timestamp. It is frozen by the ledger but not part of the canonical payload."
    }
  },
  "allOf": [
    {
      "if": {
        "properties": {
          "canonical_version": {
            "enum": ["v1", "v3"]
          }
        },
        "required": ["canonical_version"]
      },
      "then": {
        "properties": {
          "quality_verdict": {
            "type": "null"
          }
        }
      }
    },
    {
      "if": {
        "properties": {
          "canonical_version": {
            "enum": ["v2", "v4"]
          }
        },
        "required": ["canonical_version"]
      },
      "then": {
        "required": ["quality_verdict"],
        "properties": {
          "quality_verdict": {
            "type": "string",
            "minLength": 1,
            "pattern": "^[^|]+$"
          }
        }
      }
    },
    {
      "if": {
        "properties": {
          "canonical_version": {
            "enum": ["v1", "v2"]
          }
        },
        "required": ["canonical_version"]
      },
      "then": {
        "properties": {
          "signed_request_delta_micros": { "type": "null" },
          "signed_request_delta_usd": { "type": "null" },
          "request_delta_formula_version": { "type": "null" },
          "request_delta_eligible_requests": { "type": "null" },
          "request_delta_measured_requests": { "type": "null" }
        }
      }
    },
    {
      "if": {
        "properties": {
          "canonical_version": {
            "enum": ["v3", "v4"]
          }
        },
        "required": ["canonical_version"]
      },
      "then": {
        "required": [
          "signed_request_delta_micros",
          "request_delta_formula_version",
          "request_delta_eligible_requests",
          "request_delta_measured_requests"
        ],
        "properties": {
          "signed_request_delta_micros": { "type": "integer" },
          "request_delta_formula_version": { "const": "tt.request-delta-estimate.v1" },
          "request_delta_eligible_requests": { "type": "integer", "minimum": 1 },
          "request_delta_measured_requests": { "type": "integer", "minimum": 1 }
        }
      }
    }
  ],
  "additionalProperties": true,
  "$defs": {
    "uuid": {
      "type": "string",
      "format": "uuid"
    },
    "micro_usd": {
      "type": "integer"
    }
  }
}
